[
  {
    "id": 1,
    "name": "John Smith",
    "role": "Lead Banker",
    "dealId": 1,
    "email": "john.smith@bank.com",
    "phone": "(555) 123-4567",
    "department": "Investment Banking",
    "assignedDate": "2023-08-10",
    "responsibilities": ["Client Relationship", "Deal Strategy", "Pricing"],
    "notes": "Lead banker with extensive IPO experience"
  },
  {
    "id": 2,
    "name": "Sarah Johnson",
    "role": "Associate",
    "dealId": 1,
    "email": "sarah.johnson@bank.com",
    "phone": "(555) 234-5678",
    "department": "Investment Banking",
    "assignedDate": "2023-08-10",
    "responsibilities": ["Financial Modeling", "Due Diligence", "Presentation Materials"],
    "notes": "Strong financial modeling skills"
  },
  {
    "id": 3,
    "name": "Michael Chen",
    "role": "Analyst",
    "dealId": 1,
    "email": "michael.chen@bank.com",
    "phone": "(555) 345-6789",
    "department": "Investment Banking",
    "assignedDate": "2023-08-10",
    "responsibilities": ["Market Research", "Comparable Analysis", "Documentation"],
    "notes": "Detail-oriented analyst"
  },
  {
    "id": 4,
    "name": "Lisa Rodriguez",
    "role": "Legal",
    "dealId": 1,
    "email": "lisa.rodriguez@bank.com",
    "phone": "(555) 456-7890",
    "department": "Legal",
    "assignedDate": "2023-08-15",
    "responsibilities": ["Prospectus Review", "Regulatory Compliance", "Legal Documentation"],
    "notes": "Specialized in securities law"
  },
  {
    "id": 5,
    "name": "David Wilson",
    "role": "Lead Banker",
    "dealId": 2,
    "email": "david.wilson@bank.com",
    "phone": "(555) 567-8901",
    "department": "Debt Capital Markets",
    "assignedDate": "2023-10-05",
    "responsibilities": ["Client Relationship", "Deal Structure", "Pricing"],
    "notes": "Experienced in debt issuances"
  },
  {
    "id": 6,
    "name": "Emily Taylor",
    "role": "Associate",
    "dealId": 2,
    "email": "emily.taylor@bank.com",
    "phone": "(555) 678-9012",
    "department": "Debt Capital Markets",
    "assignedDate": "2023-10-05",
    "responsibilities": ["Financial Modeling", "Market Analysis", "Documentation"],
    "notes": "Strong credit analysis background"
  },
  {
    "id": 7,
    "name": "James Brown",
    "role": "Compliance",
    "dealId": 2,
    "email": "james.brown@bank.com",
    "phone": "(555) 789-0123",
    "department": "Compliance",
    "assignedDate": "2023-10-10",
    "responsibilities": ["KYC Verification", "Regulatory Compliance", "Risk Assessment"],
    "notes": "Thorough compliance officer"
  },
  {
    "id": 8,
    "name": "Robert Kim",
    "role": "Lead Banker",
    "dealId": 3,
    "email": "robert.kim@bank.com",
    "phone": "(555) 890-1234",
    "department": "M&A",
    "assignedDate": "2023-06-15",
    "responsibilities": ["Client Relationship", "Deal Strategy", "Negotiation"],
    "notes": "Experienced M&A specialist"
  },
  {
    "id": 9,
    "name": "Jennifer Lee",
    "role": "Associate",
    "dealId": 3,
    "email": "jennifer.lee@bank.com",
    "phone": "(555) 901-2345",
    "department": "M&A",
    "assignedDate": "2023-06-15",
    "responsibilities": ["Financial Modeling", "Due Diligence", "Valuation"],
    "notes": "Strong in valuation analysis"
  },
  {
    "id": 10,
    "name": "Thomas Garcia",
    "role": "Analyst",
    "dealId": 3,
    "email": "thomas.garcia@bank.com",
    "phone": "(555) 012-3456",
    "department": "M&A",
    "assignedDate": "2023-06-15",
    "responsibilities": ["Market Research", "Comparable Analysis", "Documentation"],
    "notes": "Detail-oriented analyst"
  },
  {
    "id": 11,
    "name": "Rachel Green",
    "role": "Legal",
    "dealId": 3,
    "email": "rachel.green@bank.com",
    "phone": "(555) 123-4567",
    "department": "Legal",
    "assignedDate": "2023-06-20",
    "responsibilities": ["Transaction Documents", "Regulatory Filings", "Legal Due Diligence"],
    "notes": "Specialized in M&A transactions"
  },
  {
    "id": 12,
    "name": "Daniel Martinez",
    "role": "Lead Banker",
    "dealId": 4,
    "email": "daniel.martinez@bank.com",
    "phone": "(555) 234-5678",
    "department": "Restructuring",
    "assignedDate": "2023-10-20",
    "responsibilities": ["Client Relationship", "Restructuring Strategy", "Stakeholder Management"],
    "notes": "Experienced in complex restructurings"
  },
  {
    "id": 13,
    "name": "Olivia Johnson",
    "role": "Associate",
    "dealId": 4,
    "email": "olivia.johnson@bank.com",
    "phone": "(555) 345-6789",
    "department": "Restructuring",
    "assignedDate": "2023-10-20",
    "responsibilities": ["Financial Modeling", "Creditor Analysis", "Documentation"],
    "notes": "Strong in distressed debt analysis"
  },
  {
    "id": 14,
    "name": "William Davis",
    "role": "Lead Banker",
    "dealId": 5,
    "email": "william.davis@bank.com",
    "phone": "(555) 456-7890",
    "department": "Equity Capital Markets",
    "assignedDate": "2023-08-15",
    "responsibilities": ["Client Relationship", "Deal Structure", "Pricing"],
    "notes": "Experienced in equity offerings"
  },
  {
    "id": 15,
    "name": "Sophia Miller",
    "role": "Associate",
    "dealId": 5,
    "email": "sophia.miller@bank.com",
    "phone": "(555) 567-8901",
    "department": "Equity Capital Markets",
    "assignedDate": "2023-08-15",
    "responsibilities": ["Financial Modeling", "Market Analysis", "Investor Presentations"],
    "notes": "Strong in equity market analysis"
  },
  {
    "id": 16,
    "name": "Benjamin White",
    "role": "Analyst",
    "dealId": 5,
    "email": "benjamin.white@bank.com",
    "phone": "(555) 678-9012",
    "department": "Equity Capital Markets",
    "assignedDate": "2023-08-15",
    "responsibilities": ["Market Research", "Comparable Analysis", "Documentation"],
    "notes": "Detail-oriented analyst"
  },
  {
    "id": 17,
    "name": "Emma Thompson",
    "role": "Lead Banker",
    "dealId": 6,
    "email": "emma.thompson@bank.com",
    "phone": "(555) 789-0123",
    "department": "Advisory",
    "assignedDate": "2023-05-20",
    "responsibilities": ["Client Relationship", "Strategic Advisory", "Recommendations"],
    "notes": "Experienced in international advisory"
  },
  {
    "id": 18,
    "name": "Alexander Clark",
    "role": "Associate",
    "dealId": 6,
    "email": "alexander.clark@bank.com",
    "phone": "(555) 890-1234",
    "department": "Advisory",
    "assignedDate": "2023-05-20",
    "responsibilities": ["Market Analysis", "Strategic Options", "Presentation Materials"],
    "notes": "Strong analytical skills"
  },
  {
    "id": 19,
    "name": "Natalie Wright",
    "role": "Lead Banker",
    "dealId": 7,
    "email": "natalie.wright@bank.com",
    "phone": "(555) 901-2345",
    "department": "Debt Capital Markets",
    "assignedDate": "2023-11-01",
    "responsibilities": ["Client Relationship", "Deal Structure", "Pricing"],
    "notes": "Recently assigned to the deal"
  },
  {
    "id": 20,
    "name": "Christopher Lee",
    "role": "Lead Banker",
    "dealId": 8,
    "email": "christopher.lee@bank.com",
    "phone": "(555) 012-3456",
    "department": "M&A",
    "assignedDate": "2023-07-15",
    "responsibilities": ["Client Relationship", "Deal Strategy", "Negotiation"],
    "notes": "Experienced in large-scale M&A"
  },
  {
    "id": 21,
    "name": "Amanda Harris",
    "role": "Associate",
    "dealId": 8,
    "email": "amanda.harris@bank.com",
    "phone": "(555) 123-4567",
    "department": "M&A",
    "assignedDate": "2023-07-15",
    "responsibilities": ["Financial Modeling", "Due Diligence", "Valuation"],
    "notes": "Strong in complex valuations"
  },
  {
    "id": 22,
    "name": "Matthew Wilson",
    "role": "Analyst",
    "dealId": 8,
    "email": "matthew.wilson@bank.com",
    "phone": "(555) 234-5678",
    "department": "M&A",
    "assignedDate": "2023-07-15",
    "responsibilities": ["Market Research", "Comparable Analysis", "Documentation"],
    "notes": "Detail-oriented analyst"
  },
  {
    "id": 23,
    "name": "Samantha Brown",
    "role": "Legal",
    "dealId": 8,
    "email": "samantha.brown@bank.com",
    "phone": "(555) 345-6789",
    "department": "Legal",
    "assignedDate": "2023-07-20",
    "responsibilities": ["Transaction Documents", "Regulatory Filings", "Legal Due Diligence"],
    "notes": "Specialized in technology sector M&A"
  }
]
